Sheet: example_points
A1: x | B1: y | C1: z | D1: f
A2: 0 | B2: 0 | C2: 0 | D2: of:=SUMPRODUCT([.A2:.C2];[.$F$3:.$H$3])+[.$I$3] -> 1 | F2: a | G2: b | H2: c | I2: d
A3: 0 | B3: 0 | C3: 1.5 | D3: of:=SUMPRODUCT([.A3:.C3];[.$F$3:.$H$3])+[.$I$3] -> 2.5 | F3: 1 | G3: 1 | H3: 1 | I3: 1
A4: 0 | B4: 1.5 | C4: 0 | D4: of:=SUMPRODUCT([.A4:.C4];[.$F$3:.$H$3])+[.$I$3] -> 2.5
A5: 0 | B5: 1.5 | C5: 1.5 | D5: of:=SUMPRODUCT([.A5:.C5];[.$F$3:.$H$3])+[.$I$3] -> 4 | F5: Extrema in the unit cube (origin to 1,1,1)
A6: 1.5 | B6: 0 | C6: 0 | D6: of:=SUMPRODUCT([.A6:.C6];[.$F$3:.$H$3])+[.$I$3] -> 2.5 | F6: min: | G6: of:=[.I3] -> 1
A7: 1.5 | B7: 0 | C7: 1.5 | D7: of:=SUMPRODUCT([.A7:.C7];[.$F$3:.$H$3])+[.$I$3] -> 4 | F7: max: | G7: of:=SUM([.F3:.I3]) -> 4
A8: 1.5 | B8: 1.5 | C8: 0 | D8: of:=SUMPRODUCT([.A8:.C8];[.$F$3:.$H$3])+[.$I$3] -> 4
A9: 1.5 | B9: 1.5 | C9: 1.5 | D9: of:=SUMPRODUCT([.A9:.C9];[.$F$3:.$H$3])+[.$I$3] -> 5.5
A10: of:=RAND() -> 0.237811756141199 | B10: of:=RAND() -> 0.621603273233892 | C10: of:=RAND() -> 0.982803733034737 | D10: of:=SUMPRODUCT([.A10:.C10];[.$F$3:.$H$3])+[.$I$3] -> 2.84221876240983
A11: of:=RAND() -> 0.118486433205112 | B11: of:=RAND() -> 0.0490887271946309 | C11: of:=RAND() -> 0.113739085064599 | D11: of:=SUMPRODUCT([.A11:.C11];[.$F$3:.$H$3])+[.$I$3] -> 1.28131424546434
A12: of:=RAND() -> 0.370312404978077 | B12: of:=RAND() -> 0.904910714335808 | C12: of:=RAND() -> 0.788223759739657 | D12: of:=SUMPRODUCT([.A12:.C12];[.$F$3:.$H$3])+[.$I$3] -> 3.06344687905354
A13: of:=RAND() -> 0.542685511461783 | B13: of:=RAND() -> 0.371201595852017 | C13: of:=RAND() -> 0.0880884760566155 | D13: of:=SUMPRODUCT([.A13:.C13];[.$F$3:.$H$3])+[.$I$3] -> 2.00197558337041
A14: of:=RAND() -> 0.277341520258931 | B14: of:=RAND() -> 0.395742785157554 | C14: of:=RAND() -> 0.675715922638215 | D14: of:=SUMPRODUCT([.A14:.C14];[.$F$3:.$H$3])+[.$I$3] -> 2.3488002280547
A15: of:=RAND() -> 0.088448199901271 | B15: of:=RAND() -> 0.212291162332932 | C15: of:=RAND() -> 0.0587903821834605 | D15: of:=SUMPRODUCT([.A15:.C15];[.$F$3:.$H$3])+[.$I$3] -> 1.35952974441766
A16: of:=RAND() -> 0.0912554146326843 | B16: of:=RAND() -> 0.949095931696733 | C16: of:=RAND() -> 0.582742795816642 | D16: of:=SUMPRODUCT([.A16:.C16];[.$F$3:.$H$3])+[.$I$3] -> 2.62309414214606
A17: of:=RAND() -> 0.56801044469733 | B17: of:=RAND() -> 0.666490378356081 | C17: of:=RAND() -> 0.93516776975969 | D17: of:=SUMPRODUCT([.A17:.C17];[.$F$3:.$H$3])+[.$I$3] -> 3.1696685928131
A18: of:=RAND() -> 0.141953349169247 | B18: of:=RAND() -> 0.810559488570271 | C18: of:=RAND() -> 0.637891507418497 | D18: of:=SUMPRODUCT([.A18:.C18];[.$F$3:.$H$3])+[.$I$3] -> 2.59040434515801
A19: of:=RAND() -> 0.3486293749592 | B19: of:=RAND() -> 0.230537520225173 | C19: of:=RAND() -> 0.477921546578228 | D19: of:=SUMPRODUCT([.A19:.C19];[.$F$3:.$H$3])+[.$I$3] -> 2.0570884417626
A20: of:=RAND() -> 0.21844180491367 | B20: of:=RAND() -> 0.636773686661007 | C20: of:=RAND() -> 0.529291553192539 | D20: of:=SUMPRODUCT([.A20:.C20];[.$F$3:.$H$3])+[.$I$3] -> 2.38450704476722
A21: of:=RAND() -> 0.205266902847463 | B21: of:=RAND() -> 0.442859048011451 | C21: of:=RAND() -> 0.831607487000572 | D21: of:=SUMPRODUCT([.A21:.C21];[.$F$3:.$H$3])+[.$I$3] -> 2.47973343785949
A22: of:=RAND() -> 0.451515930445066 | B22: of:=RAND() -> 0.016537720263678 | C22: of:=RAND() -> 0.818113701524925 | D22: of:=SUMPRODUCT([.A22:.C22];[.$F$3:.$H$3])+[.$I$3] -> 2.28616735223367
A23: of:=RAND() -> 0.580076777002149 | B23: of:=RAND() -> 0.204690592117963 | C23: of:=RAND() -> 0.1368347854094 | D23: of:=SUMPRODUCT([.A23:.C23];[.$F$3:.$H$3])+[.$I$3] -> 1.92160215452951
A24: of:=RAND() -> 0.574802611297219 | B24: of:=RAND() -> 0.222808812300087 | C24: of:=RAND() -> 0.862020351079989 | D24: of:=SUMPRODUCT([.A24:.C24];[.$F$3:.$H$3])+[.$I$3] -> 2.6596317746773
A25: of:=RAND() -> 0.0968462570075378 | B25: of:=RAND() -> 0.977466827864356 | C25: of:=RAND() -> 0.922974079570278 | D25: of:=SUMPRODUCT([.A25:.C25];[.$F$3:.$H$3])+[.$I$3] -> 2.99728716444217
A26: of:=RAND() -> 0.438453223410952 | B26: of:=RAND() -> 0.297090872493322 | C26: of:=RAND() -> 0.113123190209443 | D26: of:=SUMPRODUCT([.A26:.C26];[.$F$3:.$H$3])+[.$I$3] -> 1.84866728611372
A27: of:=RAND() -> 0.0747108246841005 | B27: of:=RAND() -> 0.292767047662125 | C27: of:=RAND() -> 0.433181720096968 | D27: of:=SUMPRODUCT([.A27:.C27];[.$F$3:.$H$3])+[.$I$3] -> 1.80065959244319
A28: of:=RAND() -> 0.443391477729778 | B28: of:=RAND() -> 0.765568061890181 | C28: of:=RAND() -> 0.491119563915362 | D28: of:=SUMPRODUCT([.A28:.C28];[.$F$3:.$H$3])+[.$I$3] -> 2.70007910353532
A29: of:=RAND() -> 0.672111087634454 | B29: of:=RAND() -> 0.534963306852096 | C29: of:=RAND() -> 0.111057177242372 | D29: of:=SUMPRODUCT([.A29:.C29];[.$F$3:.$H$3])+[.$I$3] -> 2.31813157172892
A30: of:=RAND() -> 0.0146987219368438 | B30: of:=RAND() -> 0.79364428937686 | C30: of:=RAND() -> 0.0299629826419623 | D30: of:=SUMPRODUCT([.A30:.C30];[.$F$3:.$H$3])+[.$I$3] -> 1.83830599395567
A31: of:=RAND() -> 0.578141373235723 | B31: of:=RAND() -> 0.856500915118321 | C31: of:=RAND() -> 0.881554722466326 | D31: of:=SUMPRODUCT([.A31:.C31];[.$F$3:.$H$3])+[.$I$3] -> 3.31619701082037
A32: of:=RAND() -> 0.954448588903106 | B32: of:=RAND() -> 0.2631797748204 | C32: of:=RAND() -> 0.257462637171836 | D32: of:=SUMPRODUCT([.A32:.C32];[.$F$3:.$H$3])+[.$I$3] -> 2.47509100089534
A33: of:=RAND() -> 0.182223586493248 | B33: of:=RAND() -> 0.660347394426151 | C33: of:=RAND() -> 0.0756093128190771 | D33: of:=SUMPRODUCT([.A33:.C33];[.$F$3:.$H$3])+[.$I$3] -> 1.91818029373848
A34: of:=RAND() -> 0.380466211023763 | B34: of:=RAND() -> 0.971983503379105 | C34: of:=RAND() -> 0.714858637051765 | D34: of:=SUMPRODUCT([.A34:.C34];[.$F$3:.$H$3])+[.$I$3] -> 3.06730835145463
A35: of:=RAND() -> 0.368633158470225 | B35: of:=RAND() -> 0.828216498999621 | C35: of:=RAND() -> 0.137937456970119 | D35: of:=SUMPRODUCT([.A35:.C35];[.$F$3:.$H$3])+[.$I$3] -> 2.33478711443996
A36: of:=RAND() -> 0.745283035800837 | B36: of:=RAND() -> 0.291058766319123 | C36: of:=RAND() -> 0.121348255747756 | D36: of:=SUMPRODUCT([.A36:.C36];[.$F$3:.$H$3])+[.$I$3] -> 2.15769005786772
A37: of:=RAND() -> 0.717566110014206 | B37: of:=RAND() -> 0.74085819637518 | C37: of:=RAND() -> 0.939185743329286 | D37: of:=SUMPRODUCT([.A37:.C37];[.$F$3:.$H$3])+[.$I$3] -> 3.39761004971867
A38: of:=RAND() -> 0.873088583435536 | B38: of:=RAND() -> 0.657162683427557 | C38: of:=RAND() -> 0.84685406061328 | D38: of:=SUMPRODUCT([.A38:.C38];[.$F$3:.$H$3])+[.$I$3] -> 3.37710532747637
A39: of:=RAND() -> 0.712802721819453 | B39: of:=RAND() -> 0.869218143073752 | C39: of:=RAND() -> 0.627765683006049 | D39: of:=SUMPRODUCT([.A39:.C39];[.$F$3:.$H$3])+[.$I$3] -> 3.20978654789925
A40: of:=RAND() -> 0.190425032406118 | B40: of:=RAND() -> 0.808127221658737 | C40: of:=RAND() -> 0.050833691875719 | D40: of:=SUMPRODUCT([.A40:.C40];[.$F$3:.$H$3])+[.$I$3] -> 2.04938594594057
A41: of:=RAND() -> 0.48981218673998 | B41: of:=RAND() -> 0.46927694054096 | C41: of:=RAND() -> 0.233799559374323 | D41: of:=SUMPRODUCT([.A41:.C41];[.$F$3:.$H$3])+[.$I$3] -> 2.19288868665526
A42: of:=RAND() -> 0.154693195774401 | B42: of:=RAND() -> 0.888240185678222 | C42: of:=RAND() -> 0.560543313708687 | D42: of:=SUMPRODUCT([.A42:.C42];[.$F$3:.$H$3])+[.$I$3] -> 2.60347669516131
A43: of:=RAND() -> 0.226547381241806 | B43: of:=RAND() -> 0.0885612974180728 | C43: of:=RAND() -> 0.237494995151474 | D43: of:=SUMPRODUCT([.A43:.C43];[.$F$3:.$H$3])+[.$I$3] -> 1.55260367381135
A44: of:=RAND() -> 0.885961848386557 | B44: of:=RAND() -> 0.879715307236109 | C44: of:=RAND() -> 0.387735634762933 | D44: of:=SUMPRODUCT([.A44:.C44];[.$F$3:.$H$3])+[.$I$3] -> 3.1534127903856
A45: of:=RAND() -> 0.466424103960529 | B45: of:=RAND() -> 0.969997725545207 | C45: of:=RAND() -> 0.831630930489682 | D45: of:=SUMPRODUCT([.A45:.C45];[.$F$3:.$H$3])+[.$I$3] -> 3.26805275999542
A46: of:=RAND() -> 0.0395828745445724 | B46: of:=RAND() -> 0.387230102940974 | C46: of:=RAND() -> 0.638503728367873 | D46: of:=SUMPRODUCT([.A46:.C46];[.$F$3:.$H$3])+[.$I$3] -> 2.06531670585342
A47: of:=RAND() -> 0.207238922336623 | B47: of:=RAND() -> 0.385063455619505 | C47: of:=RAND() -> 0.578110743686252 | D47: of:=SUMPRODUCT([.A47:.C47];[.$F$3:.$H$3])+[.$I$3] -> 2.17041312164238
A48: of:=RAND() -> 0.920440201627655 | B48: of:=RAND() -> 0.201027838073396 | C48: of:=RAND() -> 0.683001061409959 | D48: of:=SUMPRODUCT([.A48:.C48];[.$F$3:.$H$3])+[.$I$3] -> 2.80446910111101
A49: of:=RAND() -> 0.630870101768022 | B49: of:=RAND() -> 0.57583187658882 | C49: of:=RAND() -> 0.994454123628927 | D49: of:=SUMPRODUCT([.A49:.C49];[.$F$3:.$H$3])+[.$I$3] -> 3.20115610198577
A50: of:=RAND() -> 0.452937801812349 | B50: of:=RAND() -> 0.32392503196852 | C50: of:=RAND() -> 0.810868758109697 | D50: of:=SUMPRODUCT([.A50:.C50];[.$F$3:.$H$3])+[.$I$3] -> 2.58773159189057
A51: of:=RAND() -> 0.906455384426574 | B51: of:=RAND() -> 0.858585978795664 | C51: of:=RAND() -> 0.182055515191005 | D51: of:=SUMPRODUCT([.A51:.C51];[.$F$3:.$H$3])+[.$I$3] -> 2.94709687841324